{
  "$schema": "https://json-schema.org/draft/2020-12/schema",
  "additionalProperties": false,
  "properties": {
    "workspace_mounts": {
      "type": "array",
      "maxItems": 64,
      "description": "Override a Plugin Instance workspace's browser path without changing its runtime or authorization identity.",
      "items": {
        "type": "object",
        "required": ["instance", "workspace", "path"],
        "properties": {
          "instance": { "type": "string", "minLength": 1, "maxLength": 256 },
          "workspace": {
            "type": "string",
            "minLength": 1,
            "maxLength": 64
          },
          "path": { "type": "string", "minLength": 1, "maxLength": 256 }
        },
        "additionalProperties": false
      }
    },
    "liveness_readiness_routes": {
      "description": "Publish Console's GET /health/live and /health/ready routes. Disable when the App owns liveness and readiness; /health/startup remains available.",
      "type": "boolean",
      "default": true
    },
    "agent_home": {
      "description": "Private state root for the restricted Console Agent.",
      "type": "string"
    },
    "agent_configuration_store": {
      "description": "Host-owned SQLite authority for durable Console Agent configuration proposals, publication history, and desired-state recovery.",
      "type": "string"
    },
    "allowed_tools": {
      "description": "Reviewed model-visible Tools admitted to the Console Agent.",
      "items": {
        "type": "string"
      },
      "type": "array"
    },
    "connected_agent_label": {
      "description": "Identity label for the optional App Agent contributed to this Console.",
      "type": "string"
    },
    "console_agent_url": {
      "description": "Optional clean loopback HTTP origin of a Console Agent. Empty disables Agent integration; an App Console requires no Agent.",
      "type": "string"
    },
    "agent_control_token_file": {
      "description": "Optional Host-private file containing the shared Agent bearer token. The token itself never enters the Resolved App Plan.",
      "type": "string"
    },
    "connected_agent_auth_connections": {
      "description": "Explicitly authorizes Console to manage App Agent authentication connections.",
      "type": "boolean"
    },
    "connected_agent_plugin_configuration": {
      "description": "Explicitly authorizes Console to consume the App Agent Host's Plugin configuration capability.",
      "type": "boolean"
    },
    "connected_agent_plugin_lifecycle": {
      "description": "Explicitly authorizes Console to consume the App Agent Host's trusted Plugin package lifecycle capability.",
      "type": "boolean"
    },
    "connected_agent_url": {
      "description": "Clean loopback HTTP origin used by the optional App Agent Adapter.",
      "type": "string"
    },
    "managed_app_root": {
      "description": "Lenso App whose ordinary Plugin Root is managed by Console.",
      "type": "string"
    },
    "trusted_plugin_bundles": {
      "additionalProperties": {
        "type": "string"
      },
      "description": "Host-private trusted Bundle catalog keyed by opaque entry ID. Paths resolve from the launcher directory and are never exposed to Console Agent.",
      "type": "object"
    },
    "web_root": {
      "description": "Directory containing the built Console Shell index.html.",
      "type": "string"
    },
    "managed_apps": {
      "type": "array",
      "description": "Explicit Plugin management connections for non-Agent Apps and the Console extension authority. These targets do not become conversational Agents.",
      "items": {
        "type": "object",
        "additionalProperties": false,
        "required": ["id", "label", "origin"],
        "properties": {
          "id": {
            "type": "string"
          },
          "label": {
            "type": "string"
          },
          "origin": {
            "type": "string"
          },
          "consoleExtensions": {
            "type": "boolean",
            "default": false
          },
          "controlTokenEnv": {
            "type": "string"
          }
        }
      },
      "default": []
    },
    "local_projects": {
      "description": "Optional local project launcher paths owned by the reference Console Host.",
      "type": "object",
      "additionalProperties": false,
      "required": ["binary", "root", "template"],
      "properties": {
        "binary": {
          "type": "string"
        },
        "root": {
          "type": "string"
        },
        "template": {
          "type": "string"
        }
      }
    },
    "require_user_session": {
      "type": "boolean",
      "default": false,
      "description": "Require the explicitly bound Lenso Auth provider for Console API requests. Local mode has no Auth binding and remains loopback-only."
    },
    "administrator_subjects": {
      "type": "array",
      "items": {
        "type": "string",
        "minLength": 1
      },
      "uniqueItems": true,
      "default": [],
      "description": "Auth subjects allowed to administer Console and access shared Host Agent interfaces. Workspace Plugins enforce their own business authorization."
    },
    "member_workspace_ids": {
      "type": "array",
      "items": {
        "type": "string"
      },
      "uniqueItems": true,
      "default": [],
      "description": "Workspace IDs exposed to authenticated members. These Plugins must enforce their own business authorization."
    },
    "operators_profile": {
      "type": "object",
      "additionalProperties": false,
      "required": ["deployment", "issuer", "public_key"],
      "properties": {
        "deployment": {
          "type": "string",
          "minLength": 1
        },
        "issuer": {
          "type": "string",
          "minLength": 1
        },
        "public_key": {
          "type": "string",
          "minLength": 1
        },
        "max_assertion_ttl_seconds": {
          "type": "integer",
          "minimum": 1,
          "maximum": 86400,
          "default": 300,
          "description": "Maximum trusted short-lived actor assertion lifetime. Auth issuance must use the same limit or a shorter one."
        },
        "human_interface": {
          "type": "boolean",
          "default": false,
          "description": "Explicitly enables the separately bound human review capability. Never exposed as Agent or MCP tools."
        }
      },
      "description": "Explicit operators realm trust and deployment scope. Requires Auth and Access Control; legacy shared Agent/App proxies remain unavailable."
    }
  },
  "required": [
    "agent_home",
    "agent_configuration_store",
    "allowed_tools",
    "connected_agent_label",
    "connected_agent_plugin_configuration",
    "connected_agent_plugin_lifecycle",
    "connected_agent_url",
    "console_agent_url",
    "managed_app_root",
    "trusted_plugin_bundles",
    "web_root"
  ],
  "type": "object"
}
